{
  "$schema": "https://json-schema.org/draft/2020-12/schema",
  "$id": "https://github.com/augbastos/afkswitch/blob/main/spec/state.schema.json",
  "title": "AFKSwitch state, version 2",
  "description": "~/.afkswitch/state.json. Written only through the state protocol in spec/presence.md. Version 1 files (state.v1.schema.json) are read and migrated.",
  "type": "object",
  "additionalProperties": false,
  "required": [
    "version",
    "status",
    "since",
    "context",
    "generation"
  ],
  "properties": {
    "version": {
      "const": 2
    },
    "status": {
      "type": "string",
      "enum": [
        "available",
        "afk"
      ]
    },
    "since": {
      "description": "When this status began. Informative only: ordering uses generation, never clocks.",
      "type": "string",
      "format": "date-time",
      "pattern": "^\\d{4}-\\d{2}-\\d{2}T\\d{2}:\\d{2}:\\d{2}(\\.\\d+)?(Z|[+-]\\d{2}:\\d{2})$"
    },
    "context": {
      "description": "Optional user text after /afk, verbatim; at most 2048 Unicode code points, never truncated.",
      "type": [
        "string",
        "null"
      ],
      "maxLength": 2048
    },
    "generation": {
      "description": "Strictly increases by one on every durable transition; unchanged by an idempotent repeat.",
      "type": "integer",
      "minimum": 1
    }
  },
  "if": {
    "properties": {
      "status": {
        "const": "available"
      }
    }
  },
  "then": {
    "properties": {
      "context": {
        "type": "null"
      }
    }
  }
}
